{
  "$schema": "./domain-models.schema.json",
  "version": "0.1.0-review.1",
  "status": "design-backlog",
  "purpose": "Candidate domain models driven by user decisions. This hierarchy is navigation, not inheritance or a list of approved C# records.",
  "authoringSources": [
    "domain-candidates.csv",
    "domain-review-policy.json",
    "domains.csv",
    "workflows.json",
    "model.catalog.json",
    "examples/scenarios.json"
  ],
  "ratingBasis": "Editorial hypotheses based on the current user/workflow catalog and synthetic acceptance stories. No usage-frequency study or source-feasibility verification has been performed.",
  "activeDesignLimit": 8,
  "domains": [
    {
      "id": "identity_source_history",
      "name": "Identity and source history",
      "meaning": "A real/logical thing is distinct from the source rows and representations describing it",
      "groups": [
        {
          "name": "Change review",
          "models": [
            {
              "id": "source_revision_change",
              "name": "Source revision changes",
              "form": "view",
              "roles": [
                "project_manager",
                "general_contractor",
                "estimator"
              ],
              "workflows": [
                "planning",
                "coordination",
                "estimating"
              ],
              "tags": [
                "revision",
                "scope",
                "review"
              ],
              "question": "Which scope changed between issued models?",
              "decision": "Select packages to review again",
              "grain": "One proposed object change between two snapshots",
              "proposedFields": [
                "object_id",
                "before_snapshot",
                "after_snapshot",
                "change_kind",
                "match_status"
              ],
              "relationships": [
                "work_package"
              ],
              "separateBecause": "Change review needs before-and-after meaning beyond source row identifiers",
              "mergeOrDefer": "Defer until correspondence is defensible; uncertain matches remain candidates",
              "existingContract": {
                "approach": "unassessed",
                "tables": [],
                "incrementalGain": "Existing-contract fit still needs explicit review; Change review needs before-and-after meaning beyond source row identifiers"
              },
              "scenarioSupport": [],
              "priority": {
                "value": "medium",
                "impact": "high",
                "repeatUse": "occasional",
                "scopeCost": "large",
                "evidenceBasis": "brainstorm",
                "rationale": "Useful at new-delivery comparisons. The user describes data as infrequently updated, so revision comparison should not outrank every recurring query by an assumed frequent-change cadence.",
                "nextAction": "validate_next"
              }
            }
          ]
        }
      ]
    },
    {
      "id": "project_place",
      "name": "Project and place",
      "meaning": "Recognizable locations; overlapping zones and multi-storey objects remain possible",
      "groups": [
        {
          "name": "Occupancy and places",
          "models": [
            {
              "id": "space",
              "name": "Space",
              "form": "record",
              "roles": [
                "architect",
                "interior_designer",
                "facility_manager",
                "mechanical_engineer"
              ],
              "workflows": [
                "architectural_spaces",
                "finish_schedule",
                "asset_handover",
                "mep_trace"
              ],
              "tags": [
                "space",
                "occupancy",
                "handover"
              ],
              "question": "Which spaces exist and what activities and services belong to them?",
              "decision": "Review programs and room-based work",
              "grain": "One bounded or explicitly scheduled space occurrence",
              "proposedFields": [
                "object_id",
                "number",
                "name",
                "use",
                "storey_id",
                "net_area",
                "enclosure_status"
              ],
              "relationships": [
                "storey",
                "functional_zone",
                "door",
                "finish_surface"
              ],
              "separateBecause": "Room identity and room fields support many tasks",
              "mergeOrDefer": "Treat room as a space use; avoid classes per room function",
              "existingContract": {
                "approach": "proposed_new",
                "tables": [
                  "object_states"
                ],
                "incrementalGain": "A typed space view would add room number, use, measured area and enclosure meaning over shared object identity; it must not create another identity."
              },
              "scenarioSupport": [
                {
                  "scenarioId": "shared-wall-faces",
                  "supports": "Stable room references let opposite wall faces carry separate finish quantities.",
                  "doesNotEstablish": "Space enclosure, occupancy and room-area definitions."
                }
              ],
              "priority": {
                "value": "high",
                "impact": "high",
                "repeatUse": "frequent",
                "scopeCost": "medium",
                "evidenceBasis": "workflow_scenario",
                "rationale": "Room-facing finishes and service traces need stable space references; area and enclosure require separate evidence.",
                "nextAction": "design_now",
                "whyNow": "Provides a recognizable shared context for architectural schedules, finishes, services and handover without classes for each room use.",
                "acceptanceQuestion": "Can we give a room-based work list when some spaces are only scheduled, their enclosure is unknown, and services or finishes have no resolved room?"
              }
            },
            {
              "id": "storey",
              "name": "Storey",
              "form": "record",
              "roles": [
                "architect",
                "general_contractor",
                "estimator",
                "facility_manager"
              ],
              "workflows": [
                "architectural_spaces",
                "planning",
                "estimating",
                "asset_handover"
              ],
              "tags": [
                "place",
                "level",
                "navigation"
              ],
              "question": "What belongs to this building level and what does its elevation mean?",
              "decision": "Navigate and group work by level",
              "grain": "One named building level",
              "proposedFields": [
                "object_id",
                "building_id",
                "name",
                "elevation",
                "frame_id",
                "level_role"
              ],
              "relationships": [
                "space",
                "floor",
                "stair"
              ],
              "separateBecause": "A common grouping dimension needs elevation semantics",
              "mergeOrDefer": "Use associations for multi-level objects; distinguish finish and structural levels",
              "existingContract": {
                "approach": "unassessed",
                "tables": [],
                "incrementalGain": "Existing-contract fit still needs explicit review; A common grouping dimension needs elevation semantics"
              },
              "scenarioSupport": [],
              "priority": {
                "value": "high",
                "impact": "high",
                "repeatUse": "frequent",
                "scopeCost": "small",
                "evidenceBasis": "brainstorm",
                "rationale": "Expected frequent grouping value; existing workflows do not yet settle alternative level conventions.",
                "nextAction": "validate_next"
              }
            },
            {
              "id": "functional_zone",
              "name": "Functional zone membership",
              "form": "facet",
              "roles": [
                "architect",
                "mechanical_engineer",
                "safety_auditor",
                "facility_manager"
              ],
              "workflows": [
                "architectural_spaces",
                "mep_trace",
                "egress",
                "building_performance"
              ],
              "tags": [
                "zone",
                "membership",
                "overlap"
              ],
              "question": "Which spaces form this department or service zone?",
              "decision": "Scope services and assessments",
              "grain": "One object membership in a named zone under a purpose",
              "proposedFields": [
                "zone_id",
                "member_id",
                "purpose",
                "membership_basis",
                "status"
              ],
              "relationships": [
                "space",
                "equipment"
              ],
              "separateBecause": "Departments and service areas overlap beyond a place hierarchy",
              "mergeOrDefer": "Use controlled purposes; specialize only when rules differ",
              "existingContract": {
                "approach": "unassessed",
                "tables": [],
                "incrementalGain": "Existing-contract fit still needs explicit review; Departments and service areas overlap beyond a place hierarchy"
              },